{
  "schema_version": 1,
  "model": "knowledge-hub-five-plane-command-surface-v1",
  "wrapper_baseline": 49,
  "daily_command_limit": 5,
  "planes": [
    "experience",
    "query",
    "governance",
    "content-artifact",
    "evidence-operations"
  ],
  "tiers": [
    "daily",
    "maintenance",
    "governance",
    "engineering",
    "internal"
  ],
  "commands": [
    {"name":"knowledge-health-summary","wrapper":"tools/knowledge-health-summary.sh","plane":"experience","tier":"daily","summary_json":true,"read_only":true},
    {"name":"knowledge-new","wrapper":"tools/knowledge-new.sh","plane":"experience","tier":"daily","summary_json":true,"read_only":false},
    {"name":"knowledge-search","wrapper":"tools/knowledge-search.sh","plane":"query","tier":"daily","summary_json":true,"read_only":true},
    {"name":"knowledge-review-after","wrapper":"tools/knowledge-review-after.sh","plane":"governance","tier":"daily","summary_json":true,"read_only":true},
    {"name":"knowledge-check","wrapper":"tools/knowledge-check.sh","plane":"evidence-operations","tier":"daily","summary_json":true,"read_only":true},

    {"name":"knowledge-provider","wrapper":"tools/knowledge-provider.sh","plane":"query","tier":"maintenance","summary_json":true,"read_only":false},
    {"name":"knowledge-evidence-pack","wrapper":"tools/knowledge-evidence-pack.sh","plane":"query","tier":"maintenance","summary_json":false,"read_only":true},
    {"name":"knowledge-map","wrapper":"tools/knowledge-map.sh","plane":"query","tier":"maintenance","summary_json":true,"read_only":true},
    {"name":"knowledge-metrics","wrapper":"tools/knowledge-metrics.sh","plane":"evidence-operations","tier":"maintenance","summary_json":true,"read_only":true},
    {"name":"knowledge-runtime-maintenance","wrapper":"tools/knowledge-runtime-maintenance.sh","plane":"evidence-operations","tier":"maintenance","summary_json":true,"read_only":false},
    {"name":"knowledge-restore-drill","wrapper":"tools/knowledge-restore-drill.sh","plane":"evidence-operations","tier":"maintenance","summary_json":true,"read_only":true},
    {"name":"knowledge-index-plan","wrapper":"tools/knowledge-index-plan.sh","plane":"governance","tier":"maintenance","summary_json":true,"read_only":true},
    {"name":"knowledge-source-check","wrapper":"tools/knowledge-source-check.sh","plane":"governance","tier":"maintenance","summary_json":false,"read_only":true},
    {"name":"knowledge-link-audit","wrapper":"tools/knowledge-link-audit.sh","plane":"evidence-operations","tier":"maintenance","summary_json":true,"read_only":true},
    {"name":"knowledge-orphan-files","wrapper":"tools/knowledge-orphan-files.sh","plane":"evidence-operations","tier":"maintenance","summary_json":false,"read_only":true},
    {"name":"knowledge-obsidian-view-build","wrapper":"tools/knowledge-obsidian-view-build.sh","plane":"content-artifact","tier":"maintenance","summary_json":false,"read_only":true},
    {"name":"knowledge-export","wrapper":"tools/knowledge-export.sh","plane":"content-artifact","tier":"maintenance","summary_json":false,"read_only":false},
    {"name":"knowledge-reviewing-triage","wrapper":"tools/knowledge-reviewing-triage.sh","plane":"governance","tier":"maintenance","summary_json":false,"read_only":true},
    {"name":"knowledge-status","wrapper":"tools/knowledge-status.sh","plane":"evidence-operations","tier":"maintenance","summary_json":true,"read_only":true},

    {"name":"knowledge-action-check","wrapper":"tools/knowledge-action-check.sh","plane":"governance","tier":"governance","summary_json":false,"read_only":true},
    {"name":"knowledge-capture","wrapper":"tools/knowledge-capture.sh","plane":"content-artifact","tier":"governance","summary_json":true,"read_only":false},
    {"name":"knowledge-evidence-ledger","wrapper":"tools/knowledge-evidence-ledger.sh","plane":"governance","tier":"governance","summary_json":false,"read_only":true},
    {"name":"knowledge-feedback","wrapper":"tools/knowledge-feedback.sh","plane":"query","tier":"governance","summary_json":false,"read_only":false},
    {"name":"knowledge-owner-gates","wrapper":"tools/knowledge-owner-gates.sh","plane":"governance","tier":"governance","summary_json":false,"read_only":true},
    {"name":"knowledge-promote","wrapper":"tools/knowledge-promote.sh","plane":"governance","tier":"governance","summary_json":true,"read_only":false},
    {"name":"knowledge-proposal-route","wrapper":"tools/knowledge-proposal-route.sh","plane":"governance","tier":"governance","summary_json":false,"read_only":true},
    {"name":"knowledge-retire","wrapper":"tools/knowledge-retire.sh","plane":"governance","tier":"governance","summary_json":true,"read_only":false},
    {"name":"knowledge-review-attest","wrapper":"tools/knowledge-review-attest.sh","plane":"governance","tier":"governance","summary_json":false,"read_only":false},
    {"name":"knowledge-review-queue-apply","wrapper":"tools/knowledge-review-queue-apply.sh","plane":"governance","tier":"governance","summary_json":false,"read_only":false},
    {"name":"knowledge-pcr02-owner-readiness","wrapper":"tools/knowledge-pcr02-owner-readiness.sh","plane":"governance","tier":"governance","summary_json":false,"read_only":true},
    {"name":"knowledge-pcr02-owner-targets","wrapper":"tools/knowledge-pcr02-owner-targets.sh","plane":"governance","tier":"governance","summary_json":false,"read_only":true},

    {"name":"knowledge-artifact-ref-plan","wrapper":"tools/knowledge-artifact-ref-plan.sh","plane":"content-artifact","tier":"engineering","summary_json":false,"read_only":false},
    {"name":"knowledge-artifact-restore-drill","wrapper":"tools/knowledge-artifact-restore-drill.sh","plane":"content-artifact","tier":"engineering","summary_json":false,"read_only":true},
    {"name":"knowledge-compliance-eval","wrapper":"tools/knowledge-compliance-eval.sh","plane":"evidence-operations","tier":"engineering","summary_json":false,"read_only":true},
    {"name":"knowledge-engineering-check","wrapper":"tools/knowledge-engineering-check.sh","plane":"evidence-operations","tier":"engineering","summary_json":true,"read_only":true},
    {"name":"knowledge-final-gate","wrapper":"tools/knowledge-final-gate.sh","plane":"evidence-operations","tier":"engineering","summary_json":true,"read_only":true},
    {"name":"knowledge-project-readiness","wrapper":"tools/knowledge-project-readiness.sh","plane":"governance","tier":"engineering","summary_json":false,"read_only":true},
    {"name":"knowledge-regression","wrapper":"tools/knowledge-regression.sh","plane":"evidence-operations","tier":"engineering","summary_json":false,"read_only":true},
    {"name":"knowledge-regression-trend","wrapper":"tools/knowledge-regression-trend.sh","plane":"evidence-operations","tier":"engineering","summary_json":false,"read_only":true},
    {"name":"knowledge-retrieval-benchmark","wrapper":"tools/knowledge-retrieval-benchmark.sh","plane":"query","tier":"engineering","summary_json":true,"read_only":true},

    {"name":"knowledge-doctor","wrapper":"tools/knowledge-doctor.sh","plane":"evidence-operations","tier":"internal","summary_json":false,"read_only":true},
    {"name":"knowledge-inventory","wrapper":"tools/knowledge-inventory.sh","plane":"governance","tier":"internal","summary_json":false,"read_only":true},
    {"name":"knowledge-path-audit","wrapper":"tools/knowledge-path-audit.sh","plane":"governance","tier":"internal","summary_json":false,"read_only":true},
    {"name":"knowledge-proposal-shadow-stats","wrapper":"tools/knowledge-proposal-shadow-stats.sh","plane":"governance","tier":"internal","summary_json":false,"read_only":true},
    {"name":"knowledge-recovery-audit","wrapper":"tools/knowledge-recovery-audit.sh","plane":"evidence-operations","tier":"internal","summary_json":true,"read_only":true},
    {"name":"knowledge-activity","wrapper":"tools/knowledge-activity.sh","plane":"evidence-operations","tier":"internal","summary_json":true,"read_only":false},
    {"name":"knowledge-source-control","wrapper":"tools/knowledge-source-control.sh","plane":"governance","tier":"internal","summary_json":false,"read_only":false},
    {"name":"knowledge-summary-backfill","wrapper":"tools/knowledge-summary-backfill.sh","plane":"content-artifact","tier":"internal","summary_json":false,"read_only":false},
    {"name":"knowledge-workspace-discover","wrapper":"tools/knowledge-workspace-discover.sh","plane":"query","tier":"internal","summary_json":false,"read_only":true}
  ]
}
